1078,1078,1819,2376,2376,2700,SNF Supp.,513,do individual activities with each child,home,home,0.0,,,,,,,,,,,,,,,,,,,,
1079,1079,1841,2398,2398,2722,SNF Supp.,513,needs supportive staff at school to help him transition,educational activity,daycare/preschool,0.0,,,,,,,,,,,,,,,,,,,,
1080,1080,1831,2388,2388,2712,SNF Supp.,513,if his sister is helping he likes to help too,chore,home,0.0,,,,,,,,,,,,,,,,,,,,
1081,1081,1822,2379,2379,2703,SNF Supp.,513,explanation of activity/event,educational activity,daycare/preschool,0.0,,,,,,,,,,,,,,,,,,,,
1082,1082,1849,2406,2406,2730,SNF Supp.,513,racing car shopping carts help!,neighborhood outings,community,0.0,,,,,,,,,,,,,,,,,,,,
1083,1083,1840,2397,2397,2721,SNF Supp.,513,near our home/city,community,community,0.0,,,,,,,,,,,,,,,,,,,,
1084,1084,1852,2409,2409,2733,SNF Supp.,513,routine,home,home,0.0,,,,,,,,,,,,,,,,,,,,
1085,1085,1817,2374,2374,2698,SNF Supp.,513,clear boundaries (ie. when we are leaving and when we will come back),educational activity,daycare/preschool,0.0,,,,,,,,,,,,,,,,,,,,
1086,1086,1861,2418,2418,2742,SNF Supp.,513,"time variety (i.e. a day long event that you can come and go, as opposed to a specific time 1p-2p)",community,community,0.0,,,,,,,,,,,,,,,,,,,,
1087,1087,1835,2392,2392,2716,SNF Supp.,513,letting him choose games/music/etc,play,home,2.0,,,,,,,,,,,,,,,,,,,,
1088,1088,1846,2403,2403,2727,SNF Supp.,513,personalize it to his interests,home,home,2.0,,,,,,,,,,,,,,,,,,,,
1089,1089,1844,2401,2401,2725,SNF Supp.,513,other students who are well behaved,classes and groups,community,0.0,,,,,,,,,,,,,,,,,,,,
1090,1090,1821,2378,2378,2702,SNF Supp.,513,examples,chore,home,0.0,,,,,,,,,,,,,,,,,,,,
1091,1091,1857,2414,2414,2738,SNF Supp.,513,staff that is friendly to kids,neighborhood outings,community,0.0,,,,,,,,,,,,,,,,,,,,
1092,1092,1829,2386,2386,2710,SNF Supp.,513,"he loves to have a job to do, however he wants to continuously repeat this, he gets frustrated when he is done with the job",chore,home,4.0,,,,,,,,,,,,,,,,,,,,
1093,1093,1856,2413,2413,2737,SNF Supp.,513,"something to make him want to go, usually wants to stay home with daddy",neighborhood outings,community,2.0,,,,,,,,,,,,,,,,,,,,
1094,1094,1836,2393,2393,2717,SNF Supp.,513,model activity for child,home,home,0.0,,,,,,,,,,,,,,,,,,,,
1095,1095,1862,2419,2419,2743,SNF Supp.,513,timing of events (i.e. not during nap time),community,community,0.0,,,,,,,,,,,,,,,,,,,,
1096,1096,1837,2394,2394,2718,SNF Supp.,513,more advanced notice regarding special events/changes,daycare/preschool,daycare/preschool,0.0,,,,,,,,,,,,,,,,,,,,
1097,1097,1818,2375,2375,2699,SNF Supp.,513,communication with school staff on a timely basis ,daycare/preschool,daycare/preschool,0.0,,,,,,,,,,,,,,,,,,,,
1098,1098,1816,2373,2373,2697,SNF Supp.,513,also think that a chart may help improve the above,basic care routine,home,0.0,,,,,,,,,,,,,,,,,,,,
1099,1099,1827,2384,2384,2708,SNF Supp.,513,"he does well with routine, routine, routine",basic care routine,home,0.0,,,,,,,,,,,,,,,,,,,,
1100,1100,1859,2416,2416,2740,SNF Supp.,513,talk about what to expect with activity and schedule,home,home,0.0,,,,,,,,,,,,,,,,,,,,
1101,1101,1858,2415,2415,2739,SNF Supp.,513,supportive teachers/staff who know how to interact with my son,classes and groups,community,0.0,,,,,,,,,,,,,,,,,,,,
1102,1102,1864,2421,2421,2745,SNF Supp.,513,would like to see my child have more intiative to brush teeth/get ready- this could be improved with a more consistent morning routine,basic care routine,home,0.0,,,,,,,,,,,,,,,,,,,,
1103,1103,1832,2389,2389,2713,SNF Supp.,513,incentives to get them done (i.e. need to get dressed and wash hands to go to soccer practice),basic care routine,home,1.0,,,,,,,,,,,,,,,,,,,,
1104,1104,1838,2395,2395,2719,SNF Supp.,513,more communication with teacher/special ed staff,daycare/preschool,daycare/preschool,0.0,,,,,,,,,,,,,,,,,,,,
1105,1105,1830,2387,2387,2711,SNF Supp.,513,if he gets to pick something out,neighborhood outings,community,2.0,,,,,,,,,,,,,,,,,,,,
1106,1106,1820,2377,2377,2701,SNF Supp.,513,doing them with a friend,play,home,0.0,,,,,,,,,,,,,,,,,,,,
1107,1107,1824,2381,2381,2705,SNF Supp.,513,family friendly events,community,community,0.0,,,,,,,,,,,,,,,,,,,,
1108,1108,1851,2408,2408,2732,SNF Supp.,513,rewards/recognition,classes and groups,community,2.0,,,,,,,,,,,,,,,,,,,,
1109,1109,1842,2399,2399,2723,SNF Supp.,513,new toys,play,home,0.0,,,,,,,,,,,,,,,,,,,,
1110,1110,1854,2411,2411,2735,SNF Supp.,513,same teacher/support staff,daycare/preschool,daycare/preschool,0.0,,,,,,,,,,,,,,,,,,,,
1111,1111,1825,2382,2382,2706,SNF Supp.,513,have enough time/energy to do activities outside the home,educational activity,daycare/preschool,0.0,,,,,,,,,,,,,,,,,,,,
1112,1112,1833,2390,2390,2714,SNF Supp.,513,intellectually stimulating for him,daycare/preschool,daycare/preschool,4.0,,,,,,,,,,,,,,,,,,,,
1113,1113,1848,2405,2405,2729,SNF Supp.,513,positive reinforcement,chore,home,1.0,,,,,,,,,,,,,,,,,,,,
1114,1114,1853,2410,2410,2734,SNF Supp.,513,routines and structure,educational activity,daycare/preschool,0.0,,,,,,,,,,,,,,,,,,,,
1115,1115,1962,2519,2519,2843,SNF Supp.,541,Speak to him at his level,home,home,0.0,,,,,,,,,,,,,,,,,,,,
1116,1116,1957,2514,2514,2838,SNF Supp.,541,Play with him,home,home,0.0,,,,,,,,,,,,,,,,,,,,
1117,1117,1954,2511,2511,2835,SNF Supp.,541,Let him lead the play,home,home,1.0,,,,,,,,,,,,,,,,,,,,
1118,1118,1963,2520,2520,2844,SNF Supp.,541,Use activities that he is interested in,home,home,2.0,,,,,,,,,,,,,,,,,,,,
1119,1119,1953,2510,2510,2834,SNF Supp.,541,Having him help make dinner,basic care routine,home,1.0,,,,,,,,,,,,,,,,,,,,
1120,1120,1950,2507,2507,2831,SNF Supp.,541,Buying an electric toothbrush,basic care routine,home,0.0,,,,,,,,,,,,,,,,,,,,
1121,1121,1960,2517,2517,2841,SNF Supp.,541,Setting a consistent time for bed,basic care routine,home,0.0,,,,,,,,,,,,,,,,,,,,
1122,1122,1951,2508,2508,2832,SNF Supp.,541,Having access to services near where we live,community,community,0.0,,,,,,,,,,,,,,,,,,,,
1123,1123,1955,2512,2512,2836,SNF Supp.,541,Making hand washing fun,basic care routine,home,2.0,,,,,,,,,,,,,,,,,,,,
1124,1124,1959,2516,2516,2840,SNF Supp.,541,Playing with a sibling ,play,home,0.0,,,,,,,,,,,,,,,,,,,,
1125,1125,1952,2509,2509,2833,SNF Supp.,541,Having appropriate activities available year round,community,community,0.0,,,,,,,,,,,,,,,,,,,,
1126,1126,1958,2515,2515,2839,SNF Supp.,541,Playing familiar games,play,home,0.0,,,,,,,,,,,,,,,,,,,,
1127,1127,1956,2513,2513,2837,SNF Supp.,541,"Not sure, he just doesn't like us to leave him",group,community,4.0,,,,,,,,,,,,,,,,,,,,
1128,1128,1961,2518,2518,2842,SNF Supp.,541,Sign him up for more age appropriate groups,classes and groups,community,0.0,,,,,,,,,,,,,,,,,,,,
1129,1129,2269,2826,2826,3150,SNF Supp.,712,Try try again with friends,educational activity,daycare/preschool,0.0,,,,,,,,,,,,,,,,,,,,
1130,1130,2253,2810,2810,3134,SNF Supp.,712,Getting one on one instruction in organized physical activity also getting a teacher who knows about autism and her needs,classes and groups,community,3.0,,,,,,,,,,,,,,,,,,,,
1131,1131,2267,2824,2824,3148,SNF Supp.,712,The school I feel knows more about my child's understanding then I do I am so grateful for the program and ask many questions,educational,daycare/preschool,4.0,,,,,,,,,,,,,,,,,,,,
1132,1132,2255,2812,2812,3136,SNF Supp.,712,Having an extra hand ,community,community,0.0,,,,,,,,,,,,,,,,,,,,
1133,1133,2248,2805,2805,3129,SNF Supp.,712,a tablet that can just be hers,community,community,0.0,,,,,,,,,,,,,,,,,,,,
1134,1134,2251,2808,2808,3132,SNF Supp.,712,Bringing toys to play with to the beach helped,recreational,community,0.0,,,,,,,,,,,,,,,,,,,,
1135,1135,2262,2819,2819,3143,SNF Supp.,712,"she loves Blue clues, bubble guppies and sponge bob to name a few having them available with pictures so she can have a voice ",play,home,0.0,,,,,,,,,,,,,,,,,,,,
1136,1136,2259,2816,2816,3140,SNF Supp.,712,My Daughter reacts well to M&ms and if she takes a bit she can get a treat or using her words she gets a treat,basic care routine,home,2.0,,,,,,,,,,,,,,,,,,,,
1137,1137,2266,2823,2823,3147,SNF Supp.,712,She requires more of my time than my other 2 in actives so making sure the other siblings get time as well,home,home,4.0,,,,,,,,,,,,,,,,,,,,
1138,1138,2260,2817,2817,3141,SNF Supp.,712,She does a better job washing hands and using the toilet when someone there is watching her. I feel she knows not washing hands or not wiping is wrong but it doesn't click unless someone is watching her maybe she is bored.,basic care routine,home,0.0,,,,,,,,,,,,,,,,,,,,
1139,1139,2270,2827,2827,3151,SNF Supp.,712,Warn people who don't know my daughter of her needs and what to expect. Encourage them not to act any different and to still speak to her and try to engage her,social ,home,0.0,,,,,,,,,,,,,,,,,,,,
1140,1140,2261,2818,2818,3142,SNF Supp.,712,She enjoys interactions with adults ,daycare/preschool,daycare/preschool,4.0,,,,,,,,,,,,,,,,,,,,
1141,1141,2263,2820,2820,3144,SNF Supp.,712,She loves Petting zoos she connects with animals on a different level but the movie theater most often is a disaster. So we try to do what she likes to do,community sponsored,community,2.0,,,,,,,,,,,,,,,,,,,,
1142,1142,2256,2813,2813,3137,SNF Supp.,712,Having written notice from my doctors that she can return to school even when school policy says no,daycare/preschool,daycare/preschool,0.0,,,,,,,,,,,,,,,,,,,,
1143,1143,2265,2822,2822,3146,SNF Supp.,712,"She picks up toys when we do hand over hand, until she understands what we are asking her to do",chore,home,3.0,,,,,,,,,,,,,,,,,,,,
1144,1144,2268,2825,2825,3149,SNF Supp.,712,To keep trying inviting over friends even though she doesn't want anything to do with them.,social ,home,0.0,,,,,,,,,,,,,,,,,,,,
1145,1145,2254,2811,2811,3135,SNF Supp.,712,Getting puzzles of characters she likes ,play,home,2.0,,,,,,,,,,,,,,,,,,,,
1146,1146,2257,2814,2814,3138,SNF Supp.,712,I have an aid for her at church so hopefully she still can here the messages play the games and be in the same room as other kids,community sponsored,community,0.0,,,,,,,,,,,,,,,,,,,,
1147,1147,2271,2828,2828,3152,SNF Supp.,712,we have headphones but one noise is all it takes like a cough so not going out when a sibling has a cough,community,community,0.0,,,,,,,,,,,,,,,,,,,,
1148,1148,2252,2809,2809,3133,SNF Supp.,712,Getting her signed up for waivers because I can not afford the Therapy's she needs,home,home,0.0,,,,,,,,,,,,,,,,,,,,
1149,1149,2264,2821,2821,3145,SNF Supp.,712,"She loves playgrounds, she doesn't like leaving so we give warnings ",recreational,community,2.0,,,,,,,,,,,,,,,,,,,,
1150,1150,2250,2807,2807,3131,SNF Supp.,712,Bringing Tablets for her to play with during any outside of the house activity,neighborhood outings,community,0.0,,,,,,,,,,,,,,,,,,,,
1151,1151,2249,2806,2806,3130,SNF Supp.,712,Bring her to places to cut hair that work on kids and even have special days for special needs kids that need less noise and accommodations ,neighborhood outings,community,0.0,,,,,,,,,,,,,,,,,,,,
1152,1152,2258,2815,2815,3139,SNF Supp.,712,Keep challenging her with Classes and Lesson example art she has lots of sensory issues and putting different textures in front of her I see little imporvments,classes and groups,community,0.0,,,,,,,,,,,,,,,,,,,,
1153,1153,1322,1879,1879,2203,SNF Supp.,236,Having supplies available,home,home,0.0,,,,,,,,,,,,,,,,,,,,
1154,1154,1312,1869,1869,2193,SNF Supp.,236,Being encouraged by mom,basic care routine,home,1.0,,,,,,,,,,,,,,,,,,,,
1155,1155,1315,1872,1872,2196,SNF Supp.,236,Having a race against the clock- making it a game,chore,home,2.0,,,,,,,,,,,,,,,,,,,,
1156,1156,1321,1878,1878,2202,SNF Supp.,236,Having good information about what is happening,community,community,0.0,,,,,,,,,,,,,,,,,,,,
1157,1157,1323,1880,1880,2204,SNF Supp.,236,Making games easier/more at her level,home,home,0.0,,,,,,,,,,,,,,,,,,,,
1158,1158,1314,1871,1871,2195,SNF Supp.,236,having a calm environment,daycare/preschool,daycare/preschool,0.0,,,,,,,,,,,,,,,,,,,,
1159,1159,1313,1870,1870,2194,SNF Supp.,236,Competition between siblings,chore,home,4.0,,,,,,,,,,,,,,,,,,,,
1160,1160,1316,1873,1873,2197,SNF Supp.,236,Having adequate snack,daycare/preschool,daycare/preschool,0.0,,,,,,,,,,,,,,,,,,,,
1161,1161,1317,1874,1874,2198,SNF Supp.,236,"Having bathroom, food options nearby",community,community,0.0,,,,,,,,,,,,,,,,,,,,
1162,1162,1318,1875,1875,2199,SNF Supp.,236,Having clean play areas,home,home,0.0,,,,,,,,,,,,,,,,,,,,
1163,1163,1319,1876,1876,2200,SNF Supp.,236,Having feeding therapist encourage,basic care routine,home,1.0,,,,,,,,,,,,,,,,,,,,
1164,1164,1320,1877,1877,2201,SNF Supp.,236,"Having good access to events- parking, etc",community,community,0.0,,,,,,,,,,,,,,,,,,,,
1165,1165,1326,1883,1883,2207,SNF Supp.,236,Watching other child/older sister,basic care routine,home,0.0,,,,,,,,,,,,,,,,,,,,
1166,1166,1324,1881,1881,2205,SNF Supp.,236,Preparation- making sure we know what she is going to do at school,daycare/preschool,daycare/preschool,0.0,,,,,,,,,,,,,,,,,,,,
1167,1167,1325,1882,1882,2206,SNF Supp.,236,Threats to get rid of toys if they are not picked up,chore,home,2.0,,,,,,,,,,,,,,,,,,,,
1168,1168,1182,1739,1739,2063,SNF Supp.,146,Making it seem like a huge favor to help me,chore,home,1.0,,,,,,,,,,,,,,,,,,,,
1169,1169,1190,1747,1747,2071,SNF Supp.,146,We observe our surroundings and narrate what is going on. Ask her questions about what she sees,neighborhood outings,community,0.0,,,,,,,,,,,,,,,,,,,,
1170,1170,1185,1742,1742,2066,SNF Supp.,146,Playing WITH her but letting her play alone sometimes.,home,home,0.0,,,,,,,,,,,,,,,,,,,,
1171,1171,1191,1748,1748,2072,SNF Supp.,146,We watch a cartoon while we eat. I would like to limit that time as well. We are trying to cut screen time from one meal at a time. Right now we are working on dinnertime. ,play,home,0.0,,,,,,,,,,,,,,,,,,,,
1172,1172,1181,1738,1738,2062,SNF Supp.,146,"Making a deal: ""First eat your dinner, THEN we can ___""",basic care routine,home,2.0,,,,,,,,,,,,,,,,,,,,
1173,1173,1189,1746,1746,2070,SNF Supp.,146,"We bring activities when we dine out, and try to keep the meal short",neighborhood outings,community,0.0,,,,,,,,,,,,,,,,,,,,
1174,1174,1178,1735,1735,2059,SNF Supp.,146,"Giving her specific tasks to accomplish instead of the vague ""clean up this room"" we say ""please put the castle away""",chore,home,1.0,,,,,,,,,,,,,,,,,,,,
1175,1175,1187,1744,1744,2068,SNF Supp.,146,"She's an active girl, so she loves being outside. We model pieces of equipment at the park when she is unsure, but other than that we allow her to try to do as much independently as possible.",recreational,community,0.0,,,,,,,,,,,,,,,,,,,,
1176,1176,1184,1741,1741,2065,SNF Supp.,146,"Not being there allows her to focus more on the group and the activities. If I (or my spouse) is present, she is constantly checking back with us, or only interacting with us.",classes and groups,community,0.0,,,,,,,,,,,,,,,,,,,,
1177,1177,1176,1733,1733,2057,SNF Supp.,146,availability of parks,community,community,0.0,,,,,,,,,,,,,,,,,,,,
1178,1178,1186,1743,1743,2067,SNF Supp.,146,setting routines for chores,home,home,0.0,,,,,,,,,,,,,,,,,,,,
1179,1179,1188,1745,1745,2069,SNF Supp.,146,Speaking about the activities with enthusiasm. Engaging her beforehand to prepare her for what she will see/experience,community sponsored,community,0.0,,,,,,,,,,,,,,,,,,,,
1180,1180,1183,1740,1740,2064,SNF Supp.,146,Modeling hygiene/eating and then having her copy,basic care routine,home,0.0,,,,,,,,,,,,,,,,,,,,
1181,1181,1179,1736,1736,2060,SNF Supp.,146,Going to the park at least once a week to encourage socialization with unfamiliar people,home,home,0.0,,,,,,,,,,,,,,,,,,,,
1182,1182,1177,1734,1734,2058,SNF Supp.,146,Creating songs to go with the activity,basic care routine,home,0.0,,,,,,,,,,,,,,,,,,,,
1183,1183,1180,1737,1737,2061,SNF Supp.,146,"I bring an ipod loaded with her ""games"" for appointments",neighborhood outings,community,0.0,,,,,,,,,,,,,,,,,,,,
1184,1184,2140,2697,2697,3021,SNF Supp.,634,Be aware of the activities the public offers.,community,community,0.0,,,,,,,,,,,,,,,,,,,,
1185,1185,2147,2704,2704,3028,SNF Supp.,634,To dry himself off after bath time.,basic care routine,home,1.0,,,,,,,,,,,,,,,,,,,,
1186,1186,2151,2708,2708,3032,SNF Supp.,634,We teach them and speak to them lovingly.,home,home,3.0,,,,,,,,,,,,,,,,,,,,
1187,1187,2149,2706,2706,3030,SNF Supp.,634,We lead them in these activities. We're very hands on.,home,home,0.0,,,,,,,,,,,,,,,,,,,,
1188,1188,2142,2699,2699,3023,SNF Supp.,634,Brushing his own teeth well enough for me to not have to intervene.,basic care routine,home,4.0,,,,,,,,,,,,,,,,,,,,
1189,1189,2141,2698,2698,3022,SNF Supp.,634,Being close to the activities so it doesn't cost us much in gas.,community,community,0.0,,,,,,,,,,,,,,,,,,,,
1190,1190,2145,2702,2702,3026,SNF Supp.,634,Put dishes away more often after a meal.,chore,home,0.0,,,,,,,,,,,,,,,,,,,,
1191,1191,2148,2705,2705,3029,SNF Supp.,634,To wash his own body during bath time.,basic care routine,home,1.0,,,,,,,,,,,,,,,,,,,,
1192,1192,2146,2703,2703,3027,SNF Supp.,634,Putting his dishes within reach so he can get his own drink.,chore,home,1.0,,,,,,,,,,,,,,,,,,,,
1193,1193,2150,2707,2707,3031,SNF Supp.,634,"We set the tone for a loving, kind, encouraging atmosphere.",home,home,0.0,,,,,,,,,,,,,,,,,,,,
1194,1194,2143,2700,2700,3024,SNF Supp.,634,Have healthy children so that we can participate.,community,community,4.0,,,,,,,,,,,,,,,,,,,,
1195,1195,2144,2701,2701,3025,SNF Supp.,634,Help his younger brother pick up his toys.,chore,home,1.0,,,,,,,,,,,,,,,,,,,,
1196,1196,657,1128,1128,1450,WC 6m,01-054,I try to teach her to brush her teeth herself so she could learn overtime.,basic care routine,home,3.0,,,,,,,,,,,,,,,,,,,,
1197,1197,656,1127,1127,1449,WC 6m,01-054,Being in a foster home there isn't much gatherings but when there is she is involved.,social ,home,4.0,,,,,,,,,,,,,,,,,,,,
1198,1198,659,1130,1130,1452,WC 6m,01-054,I would like her to participate in more activities that can challenge her learning.,play,home,4.0,,,,,,,,,,,,,,,,,,,,
1199,1199,658,1129,1129,1451,WC 6m,01-054,I would like her to care for her foster siblings more.,chore,home,4.0,,,,,,,,,,,,,,,,,,,,
1200,1200,660,1140,1140,1462,WC 6m,01-054,"Overtime, I will enforce that she uses her teeth to chew slowly instead of eating blended food. ",basic care routine,home,2.0,,,,,,,,,,,,,,,,,,,,
1201,1201,661,1141,1141,1463,WC 6m,01-054,"Things that is done at home are acticities that make the child learn more shapes, alphabets, colours & numbers.",home,home,4.0,,,,,,,,,,,,,,,,,,,,
1202,1202,990,1547,1547,1871,SNF Supp.,99,Learn to involve himself in washing/wiping his hands/face.  But that'll come as he grows.,basic care routine,home,1.0,,,,,,,,,,,,,,,,,,,,
1203,1203,985,1542,1542,1866,SNF Supp.,99,"Growing older, child still too young",community,community,4.0,,,,,,,,,,,,,,,,,,,,
1204,1204,980,1537,1537,1861,SNF Supp.,99,Develop better pincer grasp,chore,home,4.0,,,,,,,,,,,,,,,,,,,,
1205,1205,984,1541,1541,1865,SNF Supp.,99,Grow up :),community,community,4.0,,,,,,,,,,,,,,,,,,,,
1206,1206,977,1534,1534,1858,SNF Supp.,99,Babyproof home,home,home,0.0,,,,,,,,,,,,,,,,,,,,
1207,1207,991,1548,1548,1872,SNF Supp.,99,Learn to walk and crawl on quadruped.,chore,home,3.0,,,,,,,,,,,,,,,,,,,,
1208,1208,979,1536,1536,1860,SNF Supp.,99,Changing stations in bathrooms,community,community,0.0,,,,,,,,,,,,,,,,,,,,
1209,1209,995,1552,1552,1876,SNF Supp.,99,Slowly introduce more celebrations at home,social ,home,0.0,,,,,,,,,,,,,,,,,,,,
1210,1210,997,1554,1554,1878,SNF Supp.,99,We need to attend more religious/spiritual gatherings in order to do this,community sponsored,community,4.0,,,,,,,,,,,,,,,,,,,,
1211,1211,993,1550,1550,1874,SNF Supp.,99,Outsource more work from home to allow us to attend more birthday parties/gatherings on the weekend (we work weekends),social ,home,0.0,,,,,,,,,,,,,,,,,,,,
1212,1212,981,1538,1538,1862,SNF Supp.,99,Develop pincer grasp for better picking up of finger foods so he can do it by himself.,basic care routine,home,3.0,,,,,,,,,,,,,,,,,,,,
1213,1213,983,1540,1540,1864,SNF Supp.,99,Good places for naptime,community,community,0.0,,,,,,,,,,,,,,,,,,,,
1214,1214,996,1553,1553,1877,SNF Supp.,99,Strengthen lip muscles through mouth exercises to allow drinking easily with a cup.,basic care routine,home,3.0,,,,,,,,,,,,,,,,,,,,
1215,1215,988,1545,1545,1869,SNF Supp.,99,Hire a house cleaner to allow for a safer/cleaner environment for child to explore throughout house,home,home,0.0,,,,,,,,,,,,,,,,,,,,
1216,1216,998,1555,1555,1879,SNF Supp.,99,We need to go out more,recreational,community,0.0,,,,,,,,,,,,,,,,,,,,
1217,1217,989,1546,1546,1870,SNF Supp.,99,Hire a sitter to come at home for stimulation while we work from home,home,home,0.0,,,,,,,,,,,,,,,,,,,,
1218,1218,992,1549,1549,1873,SNF Supp.,99,More regular exercise of activities recommended by therapists,home,home,0.0,,,,,,,,,,,,,,,,,,,,
1219,1219,987,1544,1544,1868,SNF Supp.,99,Have items necessary for sanitation for activities so child does not get sick,recreational,community,0.0,,,,,,,,,,,,,,,,,,,,
1220,1220,986,1543,1543,1867,SNF Supp.,99,Have child used to strangers feeding,community sponsored,community,2.0,,,,,,,,,,,,,,,,,,,,
1221,1221,978,1535,1535,1859,SNF Supp.,99,Better schedule/free time,community,community,0.0,,,,,,,,,,,,,,,,,,,,
1222,1222,982,1539,1539,1863,SNF Supp.,99,Get child more comfortable with loud noises even if during naptime,social ,home,1.0,,,,,,,,,,,,,,,,,,,,
1223,1223,994,1551,1551,1875,SNF Supp.,99,Perhaps help encourage drinking from cup and self feeding so it's less work for the daycare,community sponsored,community,1.0,,,,,,,,,,,,,,,,,,,,
1224,1224,275,496,496,726,WC Baseline ,02-037,Mediate to help her use her words to express herself so as to not get frustrated and physical,daycare/preschool,daycare/preschool,3.0,,,,,,,,,,,,,,,,,,,,
1225,1225,279,500,500,730,WC Baseline ,02-037,[name] enjoys certain types of foods. Expanding the types of foods (going beyond chocolate and fries,basic care routine,home,1.0,,,,,,,,,,,,,,,,,,,,
1226,1226,752,1309,1309,1633,WC 6m,02-037,We read books together,home,home,0.0,,,,,,,,,,,,,,,,,,,,
1227,1227,751,1308,1308,1632,WC 6m,02-037,We go for walks and go fishing or other outdoor activities,home,home,0.0,,,,,,,,,,,,,,,,,,,,
1228,1228,281,502,502,732,WC Baseline ,02-037,When she is with me on Fridays we will go to the parent/tot at the Waldorph school,home,home,0.0,,,,,,,,,,,,,,,,,,,,
1229,1229,748,1305,1305,1629,WC 6m,02-037,Allowing her her independence to learn,daycare/preschool,daycare/preschool,1.0,,,,,,,,,,,,,,,,,,,,
1230,1230,272,493,493,723,WC Baseline ,02-037,Encourage independent play with friends,daycare/preschool,daycare/preschool,1.0,,,,,,,,,,,,,,,,,,,,
1231,1231,282,503,503,733,WC Baseline ,02-037,"When the weather is nice we often will do outdoor activities (walks, feed the ducks, play on the swings/playground)",home,home,0.0,,,,,,,,,,,,,,,,,,,,
1232,1232,750,1307,1307,1631,WC 6m,02-037,"Encouraging her to use her words and ""helping hands"" ",daycare/preschool,daycare/preschool,1.0,,,,,,,,,,,,,,,,,,,,
1233,1233,753,1310,1310,1634,WC 6m,02-037,We talk about how things affect our feelings and what our body is telling us. Working on potty trg,home,home,1.0,,,,,,,,,,,,,,,,,,,,
1234,1234,274,495,495,725,WC Baseline ,02-037,Letting [name] choose what goes on her plate and encouraging her or praising when she eats something new,basic care routine,home,1.0,,,,,,,,,,,,,,,,,,,,
1235,1235,278,499,499,729,WC Baseline ,02-037,She is with me on the weekends while I'm in school so we are generally playing a lot of the time,chore,home,0.0,,,,,,,,,,,,,,,,,,,,
1236,1236,273,494,494,724,WC Baseline ,02-037,Getting [name] involved in preparing the food,basic care routine,home,1.0,,,,,,,,,,,,,,,,,,,,
1237,1237,277,498,498,728,WC Baseline ,02-037,She and I read books together. She has an active imagination so we also play toys and acting out of the toys (role playing),home,home,0.0,,,,,,,,,,,,,,,,,,,,
1238,1238,280,501,501,731,WC Baseline ,02-037,This is probably more me that needs to change how I prep meals to get he involved. She is very interested but sometimes I find it too difficult to include her as much as possible,chore,home,4.0,,,,,,,,,,,,,,,,,,,,
1239,1239,276,497,497,727,WC Baseline ,02-037,Praise her when she participates and uses her words. Having the teacher help her so she gets comforable with people other than mom/dad,daycare/preschool,daycare/preschool,1.0,,,,,,,,,,,,,,,,,,,,
1240,1240,749,1306,1306,1630,WC 6m,02-037,Encouraging her to try new things and make friends independent of her parents,daycare/preschool,daycare/preschool,1.0,,,,,,,,,,,,,,,,,,,,
1241,1241,3092,3649,3899,4223,SNF Supp.,980,"Since [name] can suffer from sensory overload very easily, we will put his compression vest on him in a crowded, high paced environment. We also will stay off to the side until [name] feels comfortable joining the crowd.",socializing,home,0.0,,,,,,,,,,,,,,,,,,,,
1242,1242,3083,3640,3890,4214,SNF Supp.,980,Having an aide for classes (i.e. gymnastics) helps [name] participate.,community,community,0.0,,,,,,,,,,,,,,,,,,,,
1243,1243,3085,3642,3892,4216,SNF Supp.,980,If we make a list of what we need from the store [name] likes to check things off one by one. ,outing ,community,0.0,,,,,,,,,,,,,,,,,,,,
1244,1244,3093,3650,3900,4224,SNF Supp.,980,"Since he is resistant to changes in his routine, and is affected intensely by changes or new things, we sometimes will use a vest that applies deep pressure to his chest and back. It's very calming and when he is calm, he is much more compliant, which is essential for getting him to sleep at a decent time.",basic care routine,home,0.0,,,,,,,,,,,,,,,,,,,,
