574,574,455,676,676,906,WC 3m,02-001,Giving her choices of activities instead of always choosing for her,educational activity,daycare/preschool,2.0,,,,,,,,,,,,,,,,,,,,
575,575,210,431,431,661,WC Baseline ,02-001,Allowing more time to do such activities,play,home,0.0,,,,,,,,,,,,,,,,,,,,
576,576,502,723,723,953,WC 3m,02-001,"Making things fun or silly, try to create a better interest",home,home,2.0,,,,,,,,,,,,,,,,,,,,
577,577,443,664,664,894,WC 3m,02-001,"Family involvement, modelling she sees eeryone doing it and wants to join",home,home,0.0,,,,,,,,,,,,,,,,,,,,
578,578,219,440,440,670,WC Baseline ,02-001,Having her sister show her and model it,chore,home,0.0,,,,,,,,,,,,,,,,,,,,
579,579,720,1277,1277,1601,WC 6m,02-001,Including Others,basic care routine,home,0.0,,,,,,,,,,,,,,,,,,,,
580,580,506,727,727,957,WC 3m,02-001,Modelling behaviour,basic care routine ,home,0.0,,,,,,,,,,,,,,,,,,,,
581,581,724,1281,1281,1605,WC 6m,02-001,Making her feel included even when it's something she can't do,chore,home,1.0,,,,,,,,,,,,,,,,,,,,
582,582,557,921,921,1242,WC 3m,02-001,Rewarding the positive behaviour,chore,home,2.0,,,,,,,,,,,,,,,,,,,,
583,583,223,444,444,674,WC Baseline ,02-001,Peer/sibling encouragement,basic care routine,home,1.0,,,,,,,,,,,,,,,,,,,,
584,584,723,1280,1280,1604,WC 6m,02-001,Learn sign language or her gestures,home,home,3.0,,,,,,,,,,,,,,,,,,,,
585,585,467,688,688,918,WC 3m,02-001,Having more get togethers to give more opportunities,social,home,0.0,,,,,,,,,,,,,,,,,,,,
586,586,225,446,446,676,WC Baseline ,02-001,Silliness and making activities seem more fun,play,home,2.0,,,,,,,,,,,,,,,,,,,,
587,587,716,1273,1273,1597,WC 6m,02-001,Having an EA 100% of the time,daycare/preschool,daycare/preschool,0.0,,,,,,,,,,,,,,,,,,,,
588,588,222,443,443,673,WC Baseline ,02-001,Peer encouragement,educational activity,daycare/preschool,1.0,,,,,,,,,,,,,,,,,,,,
589,589,718,1275,1275,1599,WC 6m,02-001,I try to attend field trips so she can be more involved,educational activity,daycare/preschool,0.0,,,,,,,,,,,,,,,,,,,,
590,590,616,980,980,1301,WC 3m,02-001,Wheelchair access,daycare/preschool,daycare/preschool,0.0,,,,,,,,,,,,,,,,,,,,
591,591,213,434,434,664,WC Baseline ,02-001,Encouraging through social interaction,play,home,1.0,,,,,,,,,,,,,,,,,,,,
592,592,478,699,699,929,WC 3m,02-001,Including other children in the activity,play,home,0.0,,,,,,,,,,,,,,,,,,,,
593,593,640,1064,1064,1386,WC 6m,01-031,Encouraged more outside time,play,home,0.0,,,,,,,,,,,,,,,,,,,,
594,594,102,135,135,222,WC Baseline ,01-031,Model social langguage and how to play,home,home,0.0,,,,,,,,,,,,,,,,,,,,
595,595,641,1065,1065,1387,WC 6m,01-031,Experienced/skilled daycare provider,daycare/preschool,daycare/preschool,0.0,,,,,,,,,,,,,,,,,,,,
596,596,434,655,655,885,WC 3m,01-031,Encourage child to participate in non screen activities by starting them myself,play,home,1.0,,,,,,,,,,,,,,,,,,,,
597,597,644,1081,1081,1403,WC 6m,01-031,Rotate toy options to pique interest,play,home,0.0,,,,,,,,,,,,,,,,,,,,
598,598,645,1082,1082,1404,WC 6m,01-031,Visit daycare environment to maintain familiarity ,educational activity,daycare/preschool,0.0,,,,,,,,,,,,,,,,,,,,
599,599,399,620,620,850,WC 3m,01-031,Allow child to be in charge of completing activity,basic care routine ,home,1.0,,,,,,,,,,,,,,,,,,,,
600,600,414,635,635,865,WC 3m,01-031,Compromised on how activity was completed,basic care routine ,home,1.0,,,,,,,,,,,,,,,,,,,,
601,601,551,915,915,1236,WC 3m,01-031,Regular attendance,daycare/preschool,daycare/preschool,0.0,,,,,,,,,,,,,,,,,,,,
602,602,106,151,151,238,WC Baseline ,01-031,This is age appropriate for my child,chore,home,4.0,,,,,,,,,,,,,,,,,,,,
603,603,647,1084,1084,1406,WC 6m,01-031,Will re-enter daycare once treatment is complete,education ,daycare/preschool,4.0,,,,,,,,,,,,,,,,,,,,
604,604,105,150,150,237,WC Baseline ,01-031,"Small home daycare, my child receives lots of attention",daycare/preschool,daycare/preschool,0.0,,,,,,,,,,,,,,,,,,,,
605,605,449,670,670,900,WC 3m,01-031,Gear our mutual activities around our child,home,home,0.0,,,,,,,,,,,,,,,,,,,,
606,606,100,133,133,220,WC Baseline ,01-031,Child limited by not walking. PT involved,educational activity,daycare/preschool,4.0,,,,,,,,,,,,,,,,,,,,
607,607,600,964,964,1285,WC 3m,01-031,Use topics of interest as connectors between activities,play,home,2.0,,,,,,,,,,,,,,,,,,,,
608,608,646,1083,1083,1405,WC 6m,01-031,Washing hands/face - allowing child to play with cloth once task complete,basic care routine,home,2.0,,,,,,,,,,,,,,,,,,,,
609,609,583,947,947,1268,WC 3m,01-031,Talk to my child aboutw hat I'm doing to pique interest,basic care routine ,home,0.0,,,,,,,,,,,,,,,,,,,,
610,610,107,152,152,239,WC Baseline ,01-031,"Use external motivation (e.g. crackers, hot wheels) to encourage increased gross motor skills",home,home,2.0,,,,,,,,,,,,,,,,,,,,
611,611,463,684,684,914,WC 3m,01-031,Have child interact in small groups with familiar children,educational activity,daycare/preschool,2.0,,,,,,,,,,,,,,,,,,,,
612,612,643,1080,1080,1402,WC 6m,01-031,One parent off work full-time to accommodate appointments and work on development,home,home,0.0,,,,,,,,,,,,,,,,,,,,
613,613,413,634,634,864,WC 3m,01-031,Complete activities on the floor to help with participation ,home,home,0.0,,,,,,,,,,,,,,,,,,,,
614,614,400,621,621,851,WC 3m,01-031,Allow for extra time for activity completion,home,home,0.0,,,,,,,,,,,,,,,,,,,,
615,615,541,905,905,1226,WC 3m,01-031,Play music videos on TV and play along with instruments,play,home,0.0,,,,,,,,,,,,,,,,,,,,
616,616,610,974,974,1295,WC 3m,01-031,We introduce child to daycare environment,educational activity,daycare/preschool,0.0,,,,,,,,,,,,,,,,,,,,
617,617,104,137,137,224,WC Baseline ,01-031,My child is attending daycare to help with interactions,social,home,0.0,,,,,,,,,,,,,,,,,,,,
618,618,543,907,907,1228,WC 3m,01-031,Practice activities at home with child to increase confidence/participation,educational activity,daycare/preschool,3.0,,,,,,,,,,,,,,,,,,,,
619,619,101,134,134,221,WC Baseline ,01-031,Have tried making activities like teeth brushing more fun for my child (e.g. letting the water run so we can splash),basic care routine,home,2.0,,,,,,,,,,,,,,,,,,,,
620,620,108,153,153,240,WC Baseline ,01-031,We sit on the floor to play with our child,home,home,0.0,,,,,,,,,,,,,,,,,,,,
621,621,642,1066,1066,1388,WC 6m,01-031,Follow through with therapy suggestions,home,home,0.0,,,,,,,,,,,,,,,,,,,,
622,622,103,136,136,223,WC Baseline ,01-031,My child doesnt walk which hinders participation with peers. PT is involved,social,home,4.0,,,,,,,,,,,,,,,,,,,,
623,623,2247,2804,2804,3128,SNF Supp.,686,Verbal praise.,chore,home,1.0,,,,,,,,,,,,,,,,,,,,
624,624,2243,2800,2800,3124,SNF Supp.,686,"If i let him make his own choices, what toothpaste to use, what shirt he would like to wear, etc.",basic care routine,home,2.0,,,,,,,,,,,,,,,,,,,,
625,625,2239,2796,2796,3120,SNF Supp.,686,Having his leap pad or a tablet with us.,neighborhood outings,community,0.0,,,,,,,,,,,,,,,,,,,,
626,626,2242,2799,2799,3123,SNF Supp.,686,If i explain what we are doing and why we are doing it.,basic care routine,home,0.0,,,,,,,,,,,,,,,,,,,,
627,627,2233,2790,2790,3114,SNF Supp.,686,Explaining what will be expected of him before actually arriving.,classes and groups,community,0.0,,,,,,,,,,,,,,,,,,,,
628,628,2246,2803,2803,3127,SNF Supp.,686,Setting a time amount and showing him where we are going and for about how long.,neighborhood outings,community,0.0,,,,,,,,,,,,,,,,,,,,
629,629,2244,2801,2801,3125,SNF Supp.,686,If i make it into a game so he thinks it is fun.,chore,home,2.0,,,,,,,,,,,,,,,,,,,,
630,630,2241,2798,2798,3122,SNF Supp.,686,If he is given verbal praise when he accomplishes a task.,basic care routine,home,1.0,,,,,,,,,,,,,,,,,,,,
631,631,2245,2802,2802,3126,SNF Supp.,686,Make a routine.,home,home,0.0,,,,,,,,,,,,,,,,,,,,
632,632,2238,2795,2795,3119,SNF Supp.,686,Having another child with us.,neighborhood outings,community,0.0,,,,,,,,,,,,,,,,,,,,
633,633,2236,2793,2793,3117,SNF Supp.,686,Having a understanding instructor.,classes and groups,community,0.0,,,,,,,,,,,,,,,,,,,,
634,634,2234,2791,2791,3115,SNF Supp.,686,Finding family friendly safe events to participate in.,community,community,0.0,,,,,,,,,,,,,,,,,,,,
635,635,2232,2789,2789,3113,SNF Supp.,686,Explaining in detail what we will be doing before hand.,community,community,0.0,,,,,,,,,,,,,,,,,,,,
636,636,2231,2788,2788,3112,SNF Supp.,686,Do things together.,home,home,0.0,,,,,,,,,,,,,,,,,,,,
637,637,2240,2797,2797,3121,SNF Supp.,686,Having other children who understand his condition in the group.,classes and groups,community,0.0,,,,,,,,,,,,,,,,,,,,
638,638,2235,2792,2792,3116,SNF Supp.,686,Having a reward system.,home,home,2.0,,,,,,,,,,,,,,,,,,,,
639,639,2237,2794,2794,3118,SNF Supp.,686,Having another adult with us to help out.,community,community,0.0,,,,,,,,,,,,,,,,,,,,
640,640,2230,2787,2787,3111,SNF Supp.,686,A reward for completing tasks.,chore,home,2.0,,,,,,,,,,,,,,,,,,,,
641,641,1287,1844,1844,2168,SNF Supp.,212,Expose him to it in brief encounters.,classes and groups,community,1.0,,,,,,,,,,,,,,,,,,,,
642,642,1285,1842,1842,2166,SNF Supp.,212,encouragement.,classes and groups,community,1.0,,,,,,,,,,,,,,,,,,,,
643,643,1295,1852,1852,2176,SNF Supp.,212,He likes putting stuff in so loading the dryer is a good task to practice start to finish.,chore,home,2.0,,,,,,,,,,,,,,,,,,,,
644,644,1291,1848,1848,2172,SNF Supp.,212,Getting other people to play with him.,community sponsored,community,0.0,,,,,,,,,,,,,,,,,,,,
645,645,1292,1849,1849,2173,SNF Supp.,212,Getting siblings to participate with him.,play,home,0.0,,,,,,,,,,,,,,,,,,,,
646,646,1297,1854,1854,2178,SNF Supp.,212,Letting him pick his own cloths has been a big help to getting him dressed.,basic care routine,home,1.0,,,,,,,,,,,,,,,,,,,,
647,647,1309,1866,1866,2190,SNF Supp.,212,Trying new things ,recreational,community,1.0,,,,,,,,,,,,,,,,,,,,
648,648,1303,1860,1860,2184,SNF Supp.,212,Reminding him what is and what is not trash. ,chore,home,2.0,,,,,,,,,,,,,,,,,,,,
649,649,1308,1865,1865,2189,SNF Supp.,212,Try to get him to interact by incorporating stuff he likes.,social ,home,2.0,,,,,,,,,,,,,,,,,,,,
650,650,1294,1851,1851,2175,SNF Supp.,212,He can not stand to be dirty or touch certian thinks so explaining to him that its ok and letting him clean off as much as he needs to has started to open him up to touching more things.,basic care routine,home,0.0,,,,,,,,,,,,,,,,,,,,
651,651,1286,1843,1843,2167,SNF Supp.,212,Explaining things over and over trying to kep him calm.,neighborhood outings,community,0.0,,,,,,,,,,,,,,,,,,,,
652,652,1304,1861,1861,2185,SNF Supp.,212,Staying away from anyplace with moving cars.,community,community,0.0,,,,,,,,,,,,,,,,,,,,
653,653,1306,1863,1863,2187,SNF Supp.,212,Try and get him to interact rather then be in control.,play,home,1.0,,,,,,,,,,,,,,,,,,,,
654,654,1288,1845,1845,2169,SNF Supp.,212,Finding something that he likes.,community sponsored,community,2.0,,,,,,,,,,,,,,,,,,,,
655,655,1298,1855,1855,2179,SNF Supp.,212,Letting him to do what other people are doing.,social ,home,1.0,,,,,,,,,,,,,,,,,,,,
656,656,1283,1840,1840,2164,SNF Supp.,212,Bringing stuff form home.,recreational,community,0.0,,,,,,,,,,,,,,,,,,,,
657,657,1282,1839,1839,2163,SNF Supp.,212,Being ok with his constant wants and needs even when he really doesn't want or need it.,home,home,0.0,,,,,,,,,,,,,,,,,,,,
658,658,1302,1859,1859,2183,SNF Supp.,212,Redirecting what is bothersome to him.,social ,home,0.0,,,,,,,,,,,,,,,,,,,,
659,659,1296,1853,1853,2177,SNF Supp.,212,Keeping it as short as I can.,outing ,community,4.0,,,,,,,,,,,,,,,,,,,,
660,660,1305,1862,1862,2186,SNF Supp.,212,Taking turns and choosing something different.,play,home,1.0,,,,,,,,,,,,,,,,,,,,
661,661,1310,1867,1867,2191,SNF Supp.,212,understanind,home,home,4.0,,,,,,,,,,,,,,,,,,,,
662,662,1289,1846,1846,2170,SNF Supp.,212,Finding space for him to run.,community,community,0.0,,,,,,,,,,,,,,,,,,,,
663,663,1311,1868,1868,2192,SNF Supp.,212,Watching where and what he seems to like.,recreational,community,2.0,,,,,,,,,,,,,,,,,,,,
664,664,1293,1850,1850,2174,SNF Supp.,212,Giving him something to do so that I can get done what has to be done.,chore,home,0.0,,,,,,,,,,,,,,,,,,,,
665,665,1300,1857,1857,2181,SNF Supp.,212,Planing for the future when he gets older.,classes and groups,community,0.0,,,,,,,,,,,,,,,,,,,,
666,666,1290,1847,1847,2171,SNF Supp.,212,Finding things that he likes or that will keep him busy.,community,community,2.0,,,,,,,,,,,,,,,,,,,,
667,667,1299,1856,1856,2180,SNF Supp.,212,Letting him to hold something or bring something of his.,neighborhood outings,community,1.0,,,,,,,,,,,,,,,,,,,,
668,668,1284,1841,1841,2165,SNF Supp.,212,Doing the same routines over and over. If he does not go to bed we have to start back at the begining.,basic care routine,home,0.0,,,,,,,,,,,,,,,,,,,,
669,669,1307,1864,1864,2188,SNF Supp.,212,Try and keep him occupied so he doesnt want to run around.,community sponsored,community,0.0,,,,,,,,,,,,,,,,,,,,
670,670,1301,1858,1858,2182,SNF Supp.,212,Playtime on his level.,home,home,0.0,,,,,,,,,,,,,,,,,,,,
671,671,2482,3039,3039,3363,SNF Supp.,762,"When my daughter eats really well I give her a lot of verbal praise. I also don't make a huge fuss if sometimes she doesn't eat as well, it just causes more of a struggle.",basic care routine,home,1.0,,,,,,,,,,,,,,,,,,,,
672,672,2465,3022,3022,3346,SNF Supp.,762,I also give her stickers for her goal sheet to pick up toys for a prize after so many stickers.,chore,home,2.0,,,,,,,,,,,,,,,,,,,,
673,673,2476,3033,3033,3357,SNF Supp.,762,Listening to my daughter and paying attention to her feelings,home,home,0.0,,,,,,,,,,,,,,,,,,,,
674,674,2463,3020,3020,3344,SNF Supp.,762,Having my daughter know that her feelings are important and that she is as a person,home,home,1.0,,,,,,,,,,,,,,,,,,,,
675,675,2472,3029,3029,3353,SNF Supp.,762,"I need to help her make more play dates, this would be my fault due to needing to set more time aside for these activities",social ,home,0.0,,,,,,,,,,,,,,,,,,,,
676,676,2468,3025,3025,3349,SNF Supp.,762,I ask a lot of questions about how my child is doing and how I can incorporate these things at home,daycare/preschool,daycare/preschool,0.0,,,,,,,,,,,,,,,,,,,,
677,677,2469,3026,3026,3350,SNF Supp.,762,I ask my child about what she did in class and what she likes,daycare/preschool,daycare/preschool,0.0,,,,,,,,,,,,,,,,,,,,
678,678,2471,3028,3028,3352,SNF Supp.,762,I give me daughter stickers for brushing her teeth on a goal sheet and after so many stickers she gets a small prize.,basic care routine,home,2.0,,,,,,,,,,,,,,,,,,,,
679,679,2478,3035,3035,3359,SNF Supp.,762,"My daughter has her own broom and dust pan. She actually enjoys dusting, so I give her a dusting clothe, she likes it when we do it together.",chore,home,0.0,,,,,,,,,,,,,,,,,,,,
680,680,2464,3021,3021,3345,SNF Supp.,762,"I allow my daughter to pick out the clothes she wants to wear, from several different weather appropriate outfits. She likes to pick out matching colors and will tell me this matches.",basic care routine,home,2.0,,,,,,,,,,,,,,,,,,,,
681,681,2479,3036,3036,3360,SNF Supp.,762,"My daughter will actually volunteer to feed her dog, and I give her lots of praise for being so helpful.",chore,home,1.0,,,,,,,,,,,,,,,,,,,,
682,682,2480,3037,3037,3361,SNF Supp.,762,"Spending quality time with her such as reading books,puzzles",home,home,0.0,,,,,,,,,,,,,,,,,,,,
683,683,2467,3024,3024,3348,SNF Supp.,762,"I always take her to the circus, carnival and fairs when it is in the season",community sponsored,community,0.0,,,,,,,,,,,,,,,,,,,,
684,684,2477,3034,3034,3358,SNF Supp.,762,"My daughter does take tap and ballet offered in my town, which is small and has limited activities but does try .",classes and groups,community,0.0,,,,,,,,,,,,,,,,,,,,
685,685,2481,3038,3038,3362,SNF Supp.,762,"We do have some activities available for kids, but not as many as in a larger town",community,community,0.0,,,,,,,,,,,,,,,,,,,,
686,686,2470,3027,3027,3351,SNF Supp.,762,I do take her to birthday parties and I find taking her once in awhile to McDonalds to play gives her an  opportunity to play with other children and meeting new people,community sponsored,community,0.0,,,,,,,,,,,,,,,,,,,,
687,687,2473,3030,3030,3354,SNF Supp.,762,I talk to the teachers about any problems or concerns my child may have,daycare/preschool,daycare/preschool,0.0,,,,,,,,,,,,,,,,,,,,
688,688,2466,3023,3023,3347,SNF Supp.,762,I also take her to parks for the same reason when weather permits,community sponsored,community,0.0,,,,,,,,,,,,,,,,,,,,
689,689,2474,3031,3031,3355,SNF Supp.,762,I will be putting my daughter in 4-H when she is 8 years old,classes and groups,community,0.0,,,,,,,,,,,,,,,,,,,,
690,690,2475,3032,3032,3356,SNF Supp.,762,I will take her to Cheyenne as weather permits for gymnastics,classes and groups,community,0.0,,,,,,,,,,,,,,,,,,,,
691,691,2776,3333,3583,3907,SNF Supp.,856,He like music ,home,home,4.0,,,,,,,,,,,,,,,,,,,,
692,692,2779,3336,3586,3910,SNF Supp.,856,We have therapy Monday thru Thursday. They teach how to work with him and try different techniques,home,home,0.0,,,,,,,,,,,,,,,,,,,,
693,693,2778,3335,3585,3909,SNF Supp.,856,We have a stander that we put him in daily to help build strength,home,home,0.0,,,,,,,,,,,,,,,,,,,,
694,694,2780,3337,3587,3911,SNF Supp.,856,We play with toys that light up and make noise,home,home,0.0,,,,,,,,,,,,,,,,,,,,
695,695,2782,3339,3589,3913,SNF Supp.,856,WE read to him,home,home,0.0,,,,,,,,,,,,,,,,,,,,
696,696,2777,3334,3584,3908,SNF Supp.,856,My child is 19 months old with severe muscle and cognitive delay. We will like him to participate more by wanting and knowing how to help us help him but I am not sure how to do this. ,basic care routine,home,4.0,,,,,,,,,,,,,,,,,,,,
697,697,2781,3338,3588,3912,SNF Supp.,856,WE play with toys that makes sounds and light up,home,home,0.0,,,,,,,,,,,,,,,,,,,,
698,698,1487,2044,2044,2368,SNF Supp.,350,Find easier ways to do them. ,basic care routine,home,0.0,,,,,,,,,,,,,,,,,,,,
699,699,1496,2053,2053,2377,SNF Supp.,350,na,group,community,4.0,,,,,,,,,,,,,,,,,,,,
700,700,1486,2043,2043,2367,SNF Supp.,350,Find different ways to get things done. ,home,home,0.0,,,,,,,,,,,,,,,,,,,,
701,701,1498,2055,2055,2379,SNF Supp.,350,No clue. ,outing ,community,4.0,,,,,,,,,,,,,,,,,,,,
702,702,1505,2062,2062,2386,SNF Supp.,350,Work on his strength. ,basic care routine,home,3.0,,,,,,,,,,,,,,,,,,,,
703,703,1501,2058,2058,2382,SNF Supp.,350,Try to keep up his strength and work around when he can do things. ,home,home,0.0,,,,,,,,,,,,,,,,,,,,
704,704,1500,2057,2057,2381,SNF Supp.,350,"Research! Tons of research on everything, ideas on how to do things, things to do, places to go, etc. ",home,home,0.0,,,,,,,,,,,,,,,,,,,,
705,705,1491,2048,2048,2372,SNF Supp.,350,have things more accessible to him. ,chore,home,0.0,,,,,,,,,,,,,,,,,,,,
706,706,1506,2063,2063,2387,SNF Supp.,350,Work on strength. ,chore,home,3.0,,,,,,,,,,,,,,,,,,,,
707,707,1489,2046,2046,2370,SNF Supp.,350,Give him lots of instructions. ,basic care routine,home,0.0,,,,,,,,,,,,,,,,,,,,
708,708,1504,2061,2061,2385,SNF Supp.,350,Work on fine motor skills. ,basic care routine,home,3.0,,,,,,,,,,,,,,,,,,,,
709,709,1492,2049,2049,2373,SNF Supp.,350,Knowing what is going on. ,community,community,0.0,,,,,,,,,,,,,,,,,,,,
710,710,1490,2047,2047,2371,SNF Supp.,350,Have lot so patience and time. ,basic care routine,home,1.0,,,,,,,,,,,,,,,,,,,,
711,711,1485,2042,2042,2366,SNF Supp.,350,Encourage him. Lots of encouragement! ,home,home,1.0,,,,,,,,,,,,,,,,,,,,
712,712,1503,2060,2060,2384,SNF Supp.,350,"When he gets older, put him in them.  ",group,community,4.0,,,,,,,,,,,,,,,,,,,,
713,713,1493,2050,2050,2374,SNF Supp.,350,Make sure he has enough rest to do the things he wants to do. ,community,community,0.0,,,,,,,,,,,,,,,,,,,,
714,714,1483,2040,2040,2364,SNF Supp.,350,Being able to go there.  He loves people!!! ,community,community,0.0,,,,,,,,,,,,,,,,,,,,
715,715,1502,2059,2059,2383,SNF Supp.,350,We are really involved. ,community,community,4.0,,,,,,,,,,,,,,,,,,,,
716,716,1484,2041,2041,2365,SNF Supp.,350,"Cooler weather and AC!!  We live in Texas it is hot and he has heat intolerance.  It puts lots of limits on things, but we do have a cooling vest. ",community,community,0.0,,,,,,,,,,,,,,,,,,,,
717,717,1488,2045,2045,2369,SNF Supp.,350,"Get him out in the world, take him places, get involved. ",community,community,0.0,,,,,,,,,,,,,,,,,,,,
718,718,1507,2064,2064,2388,SNF Supp.,350,"Work with him all the time.  Have things ready for him to do, motivate him to join in. ",home,home,0.0,,,,,,,,,,,,,,,,,,,,
719,719,1494,2051,2051,2375,SNF Supp.,350,Make time and have lots of patience. ,home,home,0.0,,,,,,,,,,,,,,,,,,,,
720,720,1499,2056,2056,2380,SNF Supp.,350,Remind him often to go potty. ,basic care routine,home,2.0,,,,,,,,,,,,,,,,,,,,
721,721,1495,2052,2052,2376,SNF Supp.,350,More consistency. ,chore,home,0.0,,,,,,,,,,,,,,,,,,,,
722,722,2483,3040,3040,3364,SNF Supp.,763,Her teachers and the director are fabulous and are going to her OT appt with us so they can help her and others.,daycare/preschool,daycare/preschool,0.0,,,,,,,,,,,,,,,,,,,,
723,723,2495,3052,3052,3376,SNF Supp.,763,Teacher encouragement and acknowledgement when she does something good is very important to her.,daycare/preschool,daycare/preschool,1.0,,,,,,,,,,,,,,,,,,,,
724,724,2500,3057,3057,3381,SNF Supp.,763,We have 5 sensory swings and a trampoline that all 3 kids love playing with.,home,home,0.0,,,,,,,,,,,,,,,,,,,,
725,725,2504,3061,3061,3385,SNF Supp.,763,"We have to encourage her to actually do activities, she is such a homebody and would prefer to stay home.  Once she is doing whatever activity we are doing, she is happy, it's just getting her to start that is hard. ",educational activity,daycare/preschool,1.0,,,,,,,,,,,,,,,,,,,,
726,726,2497,3054,3054,3378,SNF Supp.,763,To get her to take a bath or shower she has either toys or plays with the sprayer in the shower.,basic care routine,home,0.0,,,,,,,,,,,,,,,,,,,,
727,727,2496,3053,3053,3377,SNF Supp.,763,The school has a mini tramp for sensory kids available.,daycare/preschool,daycare/preschool,0.0,,,,,,,,,,,,,,,,,,,,
728,728,2493,3050,3050,3374,SNF Supp.,763,She needs to be encouraged to participate and play with others.  ,educational activity,daycare/preschool,1.0,,,,,,,,,,,,,,,,,,,,
729,729,2509,3066,3066,3390,SNF Supp.,763,"When asked to pick up toys, she says, ""I don't know how to do that.""  When we do it together, she helps a little bit.",chore,home,1.0,,,,,,,,,,,,,,,,,,,,
730,730,2505,3062,3062,3386,SNF Supp.,763,"We haven't done any organized lessons over the summer, but during the school year she was in swimming lessons.  She didn't like going, but eventually she would engage and do some of the things the rest of the class did.",classes and groups,community,0.0,,,,,,,,,,,,,,,,,,,,
731,731,2487,3044,3044,3368,SNF Supp.,763,My husband built her a number of therapy swings and we have a trampoline for her.,home,home,0.0,,,,,,,,,,,,,,,,,,,,
732,732,2485,3042,3042,3366,SNF Supp.,763,I have to suggest things for her to do with her guests otherwise she has a tendency to go off by herself.,social ,home,0.0,,,,,,,,,,,,,,,,,,,,
733,733,2494,3051,3051,3375,SNF Supp.,763,"She sometimes has to be encouraged to go to the park or beach, etc. but once there it's hard to hard to get her to leave.",community,community,1.0,,,,,,,,,,,,,,,,,,,,
734,734,2501,3058,3058,3382,SNF Supp.,763,We have a sensory bag that we play with as a family.,home,home,0.0,,,,,,,,,,,,,,,,,,,,
735,735,2507,3064,3064,3388,SNF Supp.,763,"We try to do some compromises such as doing educational games that her OT has suggested to help with her sensory disorder, etc.",play,home,0.0,,,,,,,,,,,,,,,,,,,,
736,736,2484,3041,3041,3365,SNF Supp.,763,I have to promise to brush her hair slowly in order for her to allow me to do it.,basic care routine,home,1.0,,,,,,,,,,,,,,,,,,,,
737,737,2502,3059,3059,3383,SNF Supp.,763,We have done swimming lessons in the past and will be doing again soon.  We are thinking about starting dance lessons for her as she loves to dance.,classes and groups,community,0.0,,,,,,,,,,,,,,,,,,,,
738,738,2498,3055,3055,3379,SNF Supp.,763,We got her a chair with arms for dinner time and have a weighted stuffed animal for her lap.,home,home,0.0,,,,,,,,,,,,,,,,,,,,
739,739,2503,3060,3060,3384,SNF Supp.,763,"We have little games such as ""Who can get their jammies on the fastest?""",basic care routine,home,2.0,,,,,,,,,,,,,,,,,,,,
740,740,2508,3065,3065,3389,SNF Supp.,763,We work with her using her sensory bag and encourage her in everything she does.,home,home,3.0,,,,,,,,,,,,,,,,,,,,
741,741,2511,3068,3068,3392,SNF Supp.,763,"While at the store if she has a specific task, such as putting the item in the cart, she stays more focused.  Also having a goal, such as if you listen you can choose a treat when we are done.  ",neighborhood outings,community,1.0,,,,,,,,,,,,,,,,,,,,
742,742,2510,3067,3067,3391,SNF Supp.,763,When she is offered an allowance to help out she becomes the best helper. ,chore,home,2.0,,,,,,,,,,,,,,,,,,,,
743,743,2492,3049,3049,3373,SNF Supp.,763,"She loves the iPad and likes to play games, watch movies and look at pictures.  We just have to take it away from her at times, to get her to do other things, which isn't very popular.",play,home,0.0,,,,,,,,,,,,,,,,,,,,
744,744,2491,3048,3048,3372,SNF Supp.,763,She hates having her hair brushed so we compromise and she will allow me to brush it for a few seconds if I brush slowly.  ,basic care routine,home,1.0,,,,,,,,,,,,,,,,,,,,
745,745,2488,3045,3045,3369,SNF Supp.,763,"She claims she ""doesn't know how"" to pick up her toys, etc. so if I do it with her she does a good job. ",chore,home,0.0,,,,,,,,,,,,,,,,,,,,
