1556,1556,629,1033,1033,1354,WC 6m,01-024,We haven't had guests over because his immune system has been down due to the chemo. This will change when he is healed. ,social ,home,4.0,,,,,,,,,,,,,,,,,,,,
1557,1557,72,95,95,133,WC Baseline ,01-024,"I have been doing most of those routines for him (i.e. put his clothes on, brush his teeth, etc). My next step/strategy is to teach him how to do them on his own or help me do it together.",home,home,3.0,,,,,,,,,,,,,,,,,,,,
1558,1558,513,734,734,964,WC 3m,01-024,"My son has cancer, so we can't welcome guests (unless 100% healthy). Also he is very susceptible to visitors as he thinks they're nurses who come to poke him or take his vital signs. So no guests for the moment, but once he is well and healed life will be normal and we'll welcome guests and have more celebrations so he can participate often and be more involved. ",social,home,4.0,,,,,,,,,,,,,,,,,,,,
1560,1560,2929,3486,3736,4060,SNF Supp.,938,no electronics time where we just focus on her,home,home,0.0,,,,,,,,,,,,,,,,,,,,
1561,1561,2911,3468,3718,4042,SNF Supp.,938,allowing for free play time as opposed to screen time,play,home,0.0,,,,,,,,,,,,,,,,,,,,
1562,1562,2922,3479,3729,4053,SNF Supp.,938,get city info on programs they offer,group,community,0.0,,,,,,,,,,,,,,,,,,,,
1563,1563,2936,3493,3743,4067,SNF Supp.,938,she is finally at an age where we can sign her up for activitives,group,community,4.0,,,,,,,,,,,,,,,,,,,,
1564,1564,2931,3488,3738,4062,SNF Supp.,938,providing enough time so that we arent rushing,chore,home,0.0,,,,,,,,,,,,,,,,,,,,
1565,1565,2924,3481,3731,4055,SNF Supp.,938,helping her complete the task,chore,home,3.0,,,,,,,,,,,,,,,,,,,,
1566,1566,2919,3476,3726,4050,SNF Supp.,938,enroll her ,group,community,0.0,,,,,,,,,,,,,,,,,,,,
1567,1567,2921,3478,3728,4052,SNF Supp.,938,funds to participate and buy supplies,community,community,0.0,,,,,,,,,,,,,,,,,,,,
1568,1568,2917,3474,3724,4048,SNF Supp.,938,encourage her participation,basic care routine,home,1.0,,,,,,,,,,,,,,,,,,,,
1569,1569,2933,3490,3740,4064,SNF Supp.,938,schedule fun time not just chores,community sponsored,community,0.0,,,,,,,,,,,,,,,,,,,,
1570,1570,2937,3494,3744,4068,SNF Supp.,938,sitting at the table together,basic care routine,home,0.0,,,,,,,,,,,,,,,,,,,,
1571,1571,2913,3470,3720,4044,SNF Supp.,938,appropriate weather for activity,community,community,0.0,,,,,,,,,,,,,,,,,,,,
1572,1572,2930,3487,3737,4061,SNF Supp.,938,provide alternatives to television,play,home,0.0,,,,,,,,,,,,,,,,,,,,
1573,1573,2923,3480,3730,4054,SNF Supp.,938,give her age appropriate jobs to do ,basic care routine,home,0.0,,,,,,,,,,,,,,,,,,,,
1574,1574,2910,3467,3717,4041,SNF Supp.,938,affordability,community,community,0.0,,,,,,,,,,,,,,,,,,,,
1575,1575,2925,3482,3732,4056,SNF Supp.,938,hod a close bond with her,home,home,0.0,,,,,,,,,,,,,,,,,,,,
1576,1576,2909,3466,3716,4040,SNF Supp.,938,adequate nutrition and rest,group,community,0.0,,,,,,,,,,,,,,,,,,,,
1577,1577,2927,3484,3734,4058,SNF Supp.,938,insist on limitiong screen time,play,home,0.0,,,,,,,,,,,,,,,,,,,,
1578,1578,2926,3483,3733,4057,SNF Supp.,938,information about programs,community,community,0.0,,,,,,,,,,,,,,,,,,,,
1579,1579,2920,3477,3727,4051,SNF Supp.,938,enroll her in classes,group,community,0.0,,,,,,,,,,,,,,,,,,,,
1580,1580,2939,3496,3746,4070,SNF Supp.,938,turn off or put away distractions,basic care routine,home,0.0,,,,,,,,,,,,,,,,,,,,
1581,1581,2938,3495,3745,4069,SNF Supp.,938,taking away other distraction,chore,home,0.0,,,,,,,,,,,,,,,,,,,,
1582,1582,2914,3471,3721,4045,SNF Supp.,938,asking her for help,basic care routine,home,1.0,,,,,,,,,,,,,,,,,,,,
1583,1583,2918,3475,3725,4049,SNF Supp.,938,engage her,home,home,1.0,,,,,,,,,,,,,,,,,,,,
1584,1584,2916,3473,3723,4047,SNF Supp.,938,eat as a family ,home,home,0.0,,,,,,,,,,,,,,,,,,,,
1585,1585,2912,3469,3719,4043,SNF Supp.,938,allowing her to prepare the meal,basic care routine,home,1.0,,,,,,,,,,,,,,,,,,,,
1586,1586,2932,3489,3739,4063,SNF Supp.,938,reminding her to stay on task,chore,home,2.0,,,,,,,,,,,,,,,,,,,,
1587,1587,2935,3492,3742,4066,SNF Supp.,938,setting a timer for each activity ,play,home,0.0,,,,,,,,,,,,,,,,,,,,
1588,1588,2941,3498,3748,4072,SNF Supp.,938,watching her while she completes the task,chore,home,0.0,,,,,,,,,,,,,,,,,,,,
1589,1589,2934,3491,3741,4065,SNF Supp.,938,set limits on screen time,play,home,0.0,,,,,,,,,,,,,,,,,,,,
1590,1590,2908,3465,3715,4039,SNF Supp.,938,activities at times on the weekends or evening that we can participate,community,community,0.0,,,,,,,,,,,,,,,,,,,,
1591,1591,2942,3499,3749,4073,SNF Supp.,938,we need to add this to our calendar and plan to attend,community sponsored,community,0.0,,,,,,,,,,,,,,,,,,,,
1592,1592,2915,3472,3722,4046,SNF Supp.,938,consistent routine,home,home,0.0,,,,,,,,,,,,,,,,,,,,
1593,1593,2928,3485,3735,4059,SNF Supp.,938,knowledge of the event,community,community,0.0,,,,,,,,,,,,,,,,,,,,
1594,1594,2940,3497,3747,4071,SNF Supp.,938,watch educational shows instead of 'fun' shows,play,home,0.0,,,,,,,,,,,,,,,,,,,,
1595,1595,1613,2170,2170,2494,SNF Supp.,431,Explain to him why he's needed to help and contribute,chore,home,1.0,,,,,,,,,,,,,,,,,,,,
1596,1596,1669,2226,2226,2550,SNF Supp.,431,Set rules and expectations for daily tasks to be done,basic care routine,home,2.0,,,,,,,,,,,,,,,,,,,,
1597,1597,1663,2220,2220,2544,SNF Supp.,431,Schedule work off to attend,daycare/preschool,daycare/preschool,0.0,,,,,,,,,,,,,,,,,,,,
1598,1598,1649,2206,2206,2530,SNF Supp.,431,"Organize, plan and get ideas for parties",social ,home,0.0,,,,,,,,,,,,,,,,,,,,
1599,1599,1647,2204,2204,2528,SNF Supp.,431,Organize activities for the community,community,community,0.0,,,,,,,,,,,,,,,,,,,,
1600,1600,1661,2218,2218,2542,SNF Supp.,431,Save money to put him in an activity,classes and groups,community,0.0,,,,,,,,,,,,,,,,,,,,
1601,1601,1642,2199,2199,2523,SNF Supp.,431,Make time to visit parks ,recreational,community,0.0,,,,,,,,,,,,,,,,,,,,
1602,1602,1639,2196,2196,2520,SNF Supp.,431,Make sure he's rested and fed when we head out,neighborhood outings,community,0.0,,,,,,,,,,,,,,,,,,,,
1603,1603,1625,2182,2182,2506,SNF Supp.,431,Have a set family night where we all play and bond,home,home,0.0,,,,,,,,,,,,,,,,,,,,
1604,1604,1665,2222,2222,2546,SNF Supp.,431,Schedule work off to participate in activities,educational activity,daycare/preschool,0.0,,,,,,,,,,,,,,,,,,,,
1605,1605,1653,2210,2210,2534,SNF Supp.,431,Prepare him with schedule for the day ,neighborhood outings,community,0.0,,,,,,,,,,,,,,,,,,,,
1606,1606,1619,2176,2176,2500,SNF Supp.,431,Find out what's available to do in the community,educational activity,daycare/preschool,0.0,,,,,,,,,,,,,,,,,,,,
1607,1607,1648,2205,2205,2529,SNF Supp.,431,Organize more playgroups so he can meet new/more friends,community sponsored,community,0.0,,,,,,,,,,,,,,,,,,,,
1608,1608,1640,2197,2197,2521,SNF Supp.,431,Make sure work schedule allows transporting children to activities,daycare/preschool,daycare/preschool,0.0,,,,,,,,,,,,,,,,,,,,
1609,1609,1617,2174,2174,2498,SNF Supp.,431,Find local hikes to do,recreational,community,0.0,,,,,,,,,,,,,,,,,,,,
1610,1610,1631,2188,2188,2512,SNF Supp.,431,Keep an up to date calendar with events,daycare/preschool,daycare/preschool,0.0,,,,,,,,,,,,,,,,,,,,
1611,1611,1629,2186,2186,2510,SNF Supp.,431,Having expectations for behavior when on outings,neighborhood outings,community,2.0,,,,,,,,,,,,,,,,,,,,
1612,1612,1632,2189,2189,2513,SNF Supp.,431,Keep educated on events going on,community,community,0.0,,,,,,,,,,,,,,,,,,,,
1613,1613,1636,2193,2193,2517,SNF Supp.,431,Limit screen time activities,play,home,0.0,,,,,,,,,,,,,,,,,,,,
1614,1614,1611,2168,2168,2492,SNF Supp.,431,Doing chore before play,chore,home,0.0,,,,,,,,,,,,,,,,,,,,
1615,1615,1666,2223,2223,2547,SNF Supp.,431,Schedule work so I can have more time to play with child at home,home,home,0.0,,,,,,,,,,,,,,,,,,,,
1616,1616,1641,2198,2198,2522,SNF Supp.,431,Make time in schedule to sit down and play creative games with him,play,home,0.0,,,,,,,,,,,,,,,,,,,,
1617,1617,1614,2171,2171,2495,SNF Supp.,431,Find a friend he can participate with,classes and groups,community,0.0,,,,,,,,,,,,,,,,,,,,
1618,1618,1630,2187,2187,2511,SNF Supp.,431,Introducing him to friends at different activities,educational activity,daycare/preschool,0.0,,,,,,,,,,,,,,,,,,,,
1619,1619,1637,2194,2194,2518,SNF Supp.,431,Look at local newspaper for events,classes and groups,community,0.0,,,,,,,,,,,,,,,,,,,,
1620,1620,1618,2175,2175,2499,SNF Supp.,431,Find low cost activities that are affordable,community,community,0.0,,,,,,,,,,,,,,,,,,,,
1621,1621,1643,2200,2200,2524,SNF Supp.,431,Making a list of responsible chores,chore,home,0.0,,,,,,,,,,,,,,,,,,,,
1622,1622,1655,2212,2212,2536,SNF Supp.,431,Save money to afford attending money costing activities,community sponsored,community,0.0,,,,,,,,,,,,,,,,,,,,
1623,1623,1660,2217,2217,2541,SNF Supp.,431,Save money to participate in activities or afford things to do at home,home,home,0.0,,,,,,,,,,,,,,,,,,,,
1624,1624,1633,2190,2190,2514,SNF Supp.,431,Keeping track and putting a limit to the amount of screen time he gets,play,home,0.0,,,,,,,,,,,,,,,,,,,,
1625,1625,1664,2221,2221,2545,SNF Supp.,431,Schedule work off to attend events,community,community,0.0,,,,,,,,,,,,,,,,,,,,
1626,1626,1623,2180,2180,2504,SNF Supp.,431,Go to playgroups so boys can find friends and learn to socialize,social ,home,0.0,,,,,,,,,,,,,,,,,,,,
1627,1627,1657,2214,2214,2538,SNF Supp.,431,Save money to be able to have child participate,daycare/preschool,daycare/preschool,0.0,,,,,,,,,,,,,,,,,,,,
1628,1628,1662,2219,2219,2543,SNF Supp.,431,Schedule and plan fun activities to do while at home,home,home,0.0,,,,,,,,,,,,,,,,,,,,
1629,1629,1646,2203,2203,2527,SNF Supp.,431,Offering an allowance for extra work,chore,home,2.0,,,,,,,,,,,,,,,,,,,,
1630,1630,1673,2230,2230,2554,SNF Supp.,431,Teach him different games to play as a family and with his brother,play,home,3.0,,,,,,,,,,,,,,,,,,,,
1631,1631,1612,2169,2169,2493,SNF Supp.,431,Doing it consistently,educational activity,daycare/preschool,0.0,,,,,,,,,,,,,,,,,,,,
1632,1632,1644,2201,2201,2525,SNF Supp.,431,Making it a routine so it's consistent and expected every day/night,basic care routine,home,0.0,,,,,,,,,,,,,,,,,,,,
1633,1633,1616,2173,2173,2497,SNF Supp.,431,Find and plan activities,home,home,0.0,,,,,,,,,,,,,,,,,,,,
1634,1634,1654,2211,2211,2535,SNF Supp.,431,Put in calendar so we all remember when events are,educational activity,daycare/preschool,0.0,,,,,,,,,,,,,,,,,,,,
1635,1635,1626,2183,2183,2507,SNF Supp.,431,Have a set schedule for bedtime and bath times,basic care routine,home,0.0,,,,,,,,,,,,,,,,,,,,
1636,1636,1651,2208,2208,2532,SNF Supp.,431,Plan fun trips away from home,recreational,community,0.0,,,,,,,,,,,,,,,,,,,,
1637,1637,1610,2167,2167,2491,SNF Supp.,431,Create a certain day each month to have a family sleepover with cousins,social ,home,0.0,,,,,,,,,,,,,,,,,,,,
1638,1638,1628,2185,2185,2509,SNF Supp.,431,Have more scheduled activities throughout the day for him,play,home,0.0,,,,,,,,,,,,,,,,,,,,
1639,1639,1672,2229,2229,2553,SNF Supp.,431,Take him with me and have him be a helper,neighborhood outings,community,0.0,,,,,,,,,,,,,,,,,,,,
1640,1640,1674,2231,2231,2555,SNF Supp.,431,Teach him how to do household chores and trust him to do them,chore,home,3.0,,,,,,,,,,,,,,,,,,,,
1641,1641,1645,2202,2202,2526,SNF Supp.,431,Meet friends who have kids his age that can attend groups together,classes and groups,community,0.0,,,,,,,,,,,,,,,,,,,,
1642,1642,1668,2225,2225,2549,SNF Supp.,431,Searching out and attending activities in the community,educational activity,daycare/preschool,0.0,,,,,,,,,,,,,,,,,,,,
1643,1643,1650,2207,2207,2531,SNF Supp.,431,Plan fun activities and trips,recreational,community,0.0,,,,,,,,,,,,,,,,,,,,
1644,1644,1659,2216,2216,2540,SNF Supp.,431,Save money to help with fundraisers or create ways to earn money to do so,daycare/preschool,daycare/preschool,0.0,,,,,,,,,,,,,,,,,,,,
1645,1645,1627,2184,2184,2508,SNF Supp.,431,Have meals at similar times daily,basic care routine,home,0.0,,,,,,,,,,,,,,,,,,,,
1646,1646,1638,2195,2195,2519,SNF Supp.,431,Looking at local magazines and online schedules of events,community,community,0.0,,,,,,,,,,,,,,,,,,,,
1647,1647,1615,2172,2172,2496,SNF Supp.,431,Find and do more community activities,community sponsored,community,0.0,,,,,,,,,,,,,,,,,,,,
1648,1648,1608,2165,2165,2489,SNF Supp.,431,Acquire games and ideas to use with kids,play,home,0.0,,,,,,,,,,,,,,,,,,,,
1649,1649,1634,2191,2191,2515,SNF Supp.,431,Know my area and schedule to do activities when not working,community sponsored,community,0.0,,,,,,,,,,,,,,,,,,,,
1650,1650,1621,2178,2178,2502,SNF Supp.,431,Getting to know and having a relationship with caregivers,daycare/preschool,daycare/preschool,0.0,,,,,,,,,,,,,,,,,,,,
1651,1651,1622,2179,2179,2503,SNF Supp.,431,Give him more exposure to activities,neighborhood outings,community,1.0,,,,,,,,,,,,,,,,,,,,
1652,1652,1676,2233,2233,2557,SNF Supp.,431,Teach them how to do the daily tasks that needs to happen. ,basic care routine,home,3.0,,,,,,,,,,,,,,,,,,,,
1653,1653,1656,2213,2213,2537,SNF Supp.,431,Save money to afford to put him in activities,classes and groups,community,0.0,,,,,,,,,,,,,,,,,,,,
1654,1654,1620,2177,2177,2501,SNF Supp.,431,Finding local parks and activities my kids like,recreational,community,2.0,,,,,,,,,,,,,,,,,,,,
1655,1655,1671,2228,2228,2552,SNF Supp.,431,Sign him up for the library card and take him,community sponsored,community,0.0,,,,,,,,,,,,,,,,,,,,
1656,1656,1670,2227,2227,2551,SNF Supp.,431,Sign him up for more classes,classes and groups,community,0.0,,,,,,,,,,,,,,,,,,,,
1657,1657,1667,2224,2224,2548,SNF Supp.,431,Schedule work so I have more consistent time with boys,home,home,0.0,,,,,,,,,,,,,,,,,,,,
1658,1658,1609,2166,2166,2490,SNF Supp.,431,Arrange work schedule to fit in more activities,recreational,community,0.0,,,,,,,,,,,,,,,,,,,,
1659,1659,1635,2192,2192,2516,SNF Supp.,431,Know when activities are occuring,community sponsored,community,0.0,,,,,,,,,,,,,,,,,,,,
1660,1660,1675,2232,2232,2556,SNF Supp.,431,Teach him how to do it and set certain times to do chores,chore,home,3.0,,,,,,,,,,,,,,,,,,,,
1661,1661,1652,2209,2209,2533,SNF Supp.,431,Prepare him for certain events like a hair cut or appointment,neighborhood outings,community,0.0,,,,,,,,,,,,,,,,,,,,
1662,1662,1658,2215,2215,2539,SNF Supp.,431,Save money to do events,community,community,0.0,,,,,,,,,,,,,,,,,,,,
1663,1663,1624,2181,2181,2505,SNF Supp.,431,Have a chore chart,basic care routine,home,0.0,,,,,,,,,,,,,,,,,,,,
1664,1664,2286,2843,2843,3167,SNF Supp.,715,Gather info about events.,community,community,0.0,,,,,,,,,,,,,,,,,,,,
1665,1665,2297,2854,2854,3178,SNF Supp.,715,Spend time each day working on the same game.,play,home,3.0,,,,,,,,,,,,,,,,,,,,
1666,1666,2274,2831,2831,3155,SNF Supp.,715,Attend cousin's baseball games.,community sponsored,community,0.0,,,,,,,,,,,,,,,,,,,,
1667,1667,2282,2839,2839,3163,SNF Supp.,715,Enroll into preschool.,classes and groups,community,0.0,,,,,,,,,,,,,,,,,,,,
1668,1668,2293,2850,2850,3174,SNF Supp.,715,Plan to attend.,community,community,0.0,,,,,,,,,,,,,,,,,,,,
1669,1669,2285,2842,2842,3166,SNF Supp.,715,Find ways to distract from electronics and encourage play.,play,home,0.0,,,,,,,,,,,,,,,,,,,,
1670,1670,2280,2837,2837,3161,SNF Supp.,715,Bring gear that is needed along. ,neighborhood outings,community,0.0,,,,,,,,,,,,,,,,,,,,
1671,1671,2277,2834,2834,3158,SNF Supp.,715,Attend group activities for same age children.,play,home,0.0,,,,,,,,,,,,,,,,,,,,
1672,1672,2299,2856,2856,3180,SNF Supp.,715,Talk to others about the events.,community,community,0.0,,,,,,,,,,,,,,,,,,,,
1673,1673,2290,2847,2847,3171,SNF Supp.,715,Patience in letting him try it himself.,chore,home,0.0,,,,,,,,,,,,,,,,,,,,
1674,1674,2283,2840,2840,3164,SNF Supp.,715,Find a way hikes in the woods are possible.,recreational,community,0.0,,,,,,,,,,,,,,,,,,,,
1675,1675,2273,2830,2830,3154,SNF Supp.,715,Attend church family fun nights.,community sponsored,community,0.0,,,,,,,,,,,,,,,,,,,,
1676,1676,2289,2846,2846,3170,SNF Supp.,715,Let others know he is to try it himself.,basic care routine,home,0.0,,,,,,,,,,,,,,,,,,,,
1677,1677,2296,2853,2853,3177,SNF Supp.,715,Sibling play helps social interaction.,home,home,0.0,,,,,,,,,,,,,,,,,,,,
1678,1678,2276,2833,2833,3157,SNF Supp.,715,Attend gatherings for social interaction.,social ,home,0.0,,,,,,,,,,,,,,,,,,,,
1679,1679,2295,2852,2852,3176,SNF Supp.,715,Set up ways to make it easier for him.,chore,home,0.0,,,,,,,,,,,,,,,,,,,,
1680,1680,2278,2835,2835,3159,SNF Supp.,715,Attend library programs.,classes and groups,community,0.0,,,,,,,,,,,,,,,,,,,,
1681,1681,2281,2838,2838,3162,SNF Supp.,715,Encourage grandparents to take on overnights.,recreational,community,0.0,,,,,,,,,,,,,,,,,,,,
1682,1682,2298,2855,2855,3179,SNF Supp.,715,Take the time to have him repeatedly try to get himself dressed each a.m.,basic care routine,home,0.0,,,,,,,,,,,,,,,,,,,,
1683,1683,2272,2829,2829,3153,SNF Supp.,715,Allow him to help in the kitchen preparing meals.,home,home,1.0,,,,,,,,,,,,,,,,,,,,
1684,1684,2284,2841,2841,3165,SNF Supp.,715,Find something that he can bring for others to encourage social interaction.,neighborhood outings,community,0.0,,,,,,,,,,,,,,,,,,,,
1685,1685,2291,2848,2848,3172,SNF Supp.,715,"Patience, letting him do it himself.",home,home,0.0,,,,,,,,,,,,,,,,,,,,
1686,1686,2287,2844,2844,3168,SNF Supp.,715,Invite children over for play.,social ,home,0.0,,,,,,,,,,,,,,,,,,,,
1687,1687,2301,2858,2858,3182,SNF Supp.,715,Tent in the backyard.,recreational,community,0.0,,,,,,,,,,,,,,,,,,,,
1688,1688,2300,2857,2857,3181,SNF Supp.,715,Talk with him re: what to expect about school.,classes and groups,community,0.0,,,,,,,,,,,,,,,,,,,,
1689,1689,2275,2832,2832,3156,SNF Supp.,715,Attend family dinners for cousin interaction.,social ,home,0.0,,,,,,,,,,,,,,,,,,,,
1690,1690,2292,2849,2849,3173,SNF Supp.,715,Plan gatherings at our place for same age children to attend.,neighborhood outings,community,0.0,,,,,,,,,,,,,,,,,,,,
1691,1691,2294,2851,2851,3175,SNF Supp.,715,Purchase clothing that is easiest to put on.,basic care routine,home,0.0,,,,,,,,,,,,,,,,,,,,
1692,1692,2288,2845,2845,3169,SNF Supp.,715,Let others know he is to do it himself.,chore,home,0.0,,,,,,,,,,,,,,,,,,,,
1693,1693,2155,2712,2712,3036,SNF Supp.,647,ask her for help with certain tasks,chore,home,1.0,,,,,,,,,,,,,,,,,,,,
1694,1694,2179,2736,2736,3060,SNF Supp.,647,spend time with friends who may also be involved,classes and groups,community,0.0,,,,,,,,,,,,,,,,,,,,
1695,1695,2152,2709,2709,3033,SNF Supp.,647,adequate advertisement of activities,community,community,0.0,,,,,,,,,,,,,,,,,,,,
1696,1696,2181,2738,2738,3062,SNF Supp.,647,Talk about and demonstrate gentle touches with siblings and animals,chore,home,0.0,,,,,,,,,,,,,,,,,,,,
1697,1697,2176,2733,2733,3057,SNF Supp.,647,"sing the ""clean up time"" song before and during picking up toys ",chore,home,0.0,,,,,,,,,,,,,,,,,,,,
1698,1698,2170,2727,2727,3051,SNF Supp.,647,practicing sitting on the potty chair after a diaper change,basic care routine,home,3.0,,,,,,,,,,,,,,,,,,,,
1699,1699,2158,2715,2715,3039,SNF Supp.,647,choosing a pretty dress to wear for the day,basic care routine,home,0.0,,,,,,,,,,,,,,,,,,,,
1700,1700,2156,2713,2713,3037,SNF Supp.,647,choose activities geared towards kids,community,community,0.0,,,,,,,,,,,,,,,,,,,,
1701,1701,2173,2730,2730,3054,SNF Supp.,647,reading books and singing songs before getting into bed for bedtime or naptime,basic care routine,home,0.0,,,,,,,,,,,,,,,,,,,,
1702,1702,2182,2739,2739,3063,SNF Supp.,647,talk about the planned activity before it takes place,classes and groups,community,0.0,,,,,,,,,,,,,,,,,,,,
1703,1703,2167,2724,2724,3048,SNF Supp.,647,offering help when getting dressed,basic care routine,home,3.0,,,,,,,,,,,,,,,,,,,,
1704,1704,2180,2737,2737,3061,SNF Supp.,647,structured routine,daycare/preschool,daycare/preschool,0.0,,,,,,,,,,,,,,,,,,,,
1705,1705,2166,2723,2723,3047,SNF Supp.,647,meet teachers and other adults involved before activity begins,classes and groups,community,0.0,,,,,,,,,,,,,,,,,,,,
1706,1706,2163,2720,2720,3044,SNF Supp.,647,invite to participate in cooking and laundry chores,chore,home,1.0,,,,,,,,,,,,,,,,,,,,
1707,1707,2161,2718,2718,3042,SNF Supp.,647,good weather,community,community,0.0,,,,,,,,,,,,,,,,,,,,
1708,1708,2162,2719,2719,3043,SNF Supp.,647,hand her wipes to clean hands and face or table,chore,home,0.0,,,,,,,,,,,,,,,,,,,,
1709,1709,2168,2725,2725,3049,SNF Supp.,647,outdoor play,daycare/preschool,daycare/preschool,0.0,,,,,,,,,,,,,,,,,,,,
1710,1710,2160,2717,2717,3041,SNF Supp.,647,give lots of hugs,home,home,0.0,,,,,,,,,,,,,,,,,,,,
1711,1711,2154,2711,2711,3035,SNF Supp.,647,adequate snacks and meals offered,daycare/preschool,daycare/preschool,1.0,,,,,,,,,,,,,,,,,,,,
1712,1712,2157,2714,2714,3038,SNF Supp.,647,"choose daytime activities, nothing past bedtime",community,community,0.0,,,,,,,,,,,,,,,,,,,,
1713,1713,2177,2734,2734,3058,SNF Supp.,647,sing the clean up song,chore,home,0.0,,,,,,,,,,,,,,,,,,,,
1714,1714,2172,2729,2729,3053,SNF Supp.,647,read books together,home,home,0.0,,,,,,,,,,,,,,,,,,,,
1715,1715,2165,2722,2722,3046,SNF Supp.,647,make sure schedule is consistent and naps are routine,home,home,0.0,,,,,,,,,,,,,,,,,,,,
1716,1716,2184,2741,2741,3065,SNF Supp.,647,using detangle spray to make hair brushing more comfortable,basic care routine,home,0.0,,,,,,,,,,,,,,,,,,,,
1717,1717,2169,2726,2726,3050,SNF Supp.,647,plan for adequate amounts of outside play,home,home,0.0,,,,,,,,,,,,,,,,,,,,
1718,1718,2174,2731,2731,3055,SNF Supp.,647,she has never really taken and organized activity before,group,community,4.0,,,,,,,,,,,,,,,,,,,,
1719,1719,2175,2732,2732,3056,SNF Supp.,647,sing songs together,home,home,0.0,,,,,,,,,,,,,,,,,,,,
1720,1720,2153,2710,2710,3034,SNF Supp.,647,adequate nap time provieded,daycare/preschool,daycare/preschool,1.0,,,,,,,,,,,,,,,,,,,,
1721,1721,2164,2721,2721,3045,SNF Supp.,647,love and attention,daycare/preschool,daycare/preschool,0.0,,,,,,,,,,,,,,,,,,,,
1722,1722,2183,2740,2740,3064,SNF Supp.,647,timing around naps and bedtime,community,community,0.0,,,,,,,,,,,,,,,,,,,,
1723,1723,2159,2716,2716,3040,SNF Supp.,647,fun songs and activities planned,daycare/preschool,daycare/preschool,0.0,,,,,,,,,,,,,,,,,,,,
1724,1724,2171,2728,2728,3052,SNF Supp.,647,provide proper nutrition such as adequate meals and snacks so no one has the opportunity to be hungry. ,home,home,0.0,,,,,,,,,,,,,,,,,,,,
1725,1725,1556,2113,2113,2437,SNF Supp.,392,Understand how to do more on a tablet,play,home,3.0,,,,,,,,,,,,,,,,,,,,
1726,1726,1555,2112,2112,2436,SNF Supp.,392,Playgrounds like inspiration park that allow her to use her walker,recreational,community,0.0,,,,,,,,,,,,,,,,,,,,
1727,1727,1557,2114,2114,2438,SNF Supp.,392,Understand the concept,chore,home,3.0,,,,,,,,,,,,,,,,,,,,
1728,1728,1549,2106,2106,2430,SNF Supp.,392,"Improved hand coordination and use for holding crayons, paint brushes, etc.",play,home,3.0,,,,,,,,,,,,,,,,,,,,
1729,1729,1548,2105,2105,2429,SNF Supp.,392,High chairs and diaper changing stations,neighborhood outings,community,0.0,,,,,,,,,,,,,,,,,,,,
1730,1730,1554,2111,2111,2435,SNF Supp.,392,Places that make it easy for her to see the action f,community,community,0.0,,,,,,,,,,,,,,,,,,,,
1731,1731,1546,2103,2103,2427,SNF Supp.,392,"Getting her interested in the activity, able to pay attention to it",community sponsored,community,2.0,,,,,,,,,,,,,,,,,,,,
1732,1732,1551,2108,2108,2432,SNF Supp.,392,Learn to help getting dressed,basic care routine,home,3.0,,,,,,,,,,,,,,,,,,,,
1733,1733,1552,2109,2109,2433,SNF Supp.,392,Learn to help washing face and hands,basic care routine,home,3.0,,,,,,,,,,,,,,,,,,,,
1734,1734,1553,2110,2110,2434,SNF Supp.,392,Places that accommodate strollers or her walker,community,community,0.0,,,,,,,,,,,,,,,,,,,,
1735,1735,1558,2115,2115,2439,SNF Supp.,392,Unsure?,socializing,home,4.0,,,,,,,,,,,,,,,,,,,,
1736,1736,1547,2104,2104,2428,SNF Supp.,392,Help her get around to access toys,home,home,3.0,,,,,,,,,,,,,,,,,,,,
1737,1737,1550,2107,2107,2431,SNF Supp.,392,Learn to feed herself with spoon,basic care routine,home,3.0,,,,,,,,,,,,,,,,,,,,
1738,1738,1724,2281,2281,2605,SNF Supp.,446,Giving lots of options to choose from,play,home,2.0,,,,,,,,,,,,,,,,,,,,
1739,1739,1721,2278,2278,2602,SNF Supp.,446,Finding friends that can match her energy level,social ,home,0.0,,,,,,,,,,,,,,,,,,,,
1740,1740,1738,2295,2295,2619,SNF Supp.,446,Use of fm system,recreational,community,0.0,,,,,,,,,,,,,,,,,,,,
1741,1741,1726,2283,2283,2607,SNF Supp.,446,having fun activities,social ,home,0.0,,,,,,,,,,,,,,,,,,,,
1742,1742,1733,2290,2290,2614,SNF Supp.,446,Posting picture schedules of routines,basic care routine,home,0.0,,,,,,,,,,,,,,,,,,,,
1743,1743,1718,2275,2275,2599,SNF Supp.,446,Direct face to face communication,home,home,0.0,,,,,,,,,,,,,,,,,,,,
1744,1744,1734,2291,2291,2615,SNF Supp.,446,"Preparing ahead, letting know where going ",recreational,community,0.0,,,,,,,,,,,,,,,,,,,,
1745,1745,1720,2277,2277,2601,SNF Supp.,446,finding activities that are in line with interests,community,community,2.0,,,,,,,,,,,,,,,,,,,,
1746,1746,1730,2287,2287,2611,SNF Supp.,446,offering rewards,chore,home,2.0,,,,,,,,,,,,,,,,,,,,
1747,1747,1714,2271,2271,2595,SNF Supp.,446,Changing activities so not bored from same thing all the time,play,home,0.0,,,,,,,,,,,,,,,,,,,,
1748,1748,1739,2296,2296,2620,SNF Supp.,446,Use of fm system so can hear from further distances,neighborhood outings,community,0.0,,,,,,,,,,,,,,,,,,,,
1749,1749,1742,2299,2299,2623,SNF Supp.,446,Willingness to adopt strategies to assist with communication,community,community,0.0,,,,,,,,,,,,,,,,,,,,
1750,1750,1713,2270,2270,2594,SNF Supp.,446,activities that are matched to childs interests,play,home,2.0,,,,,,,,,,,,,,,,,,,,
1751,1751,1731,2288,2288,2612,SNF Supp.,446,peers of similar age and with similar interests,social ,home,0.0,,,,,,,,,,,,,,,,,,,,
